#TAG,NAME IN REPO (or git url),PURPOSE (should be a verb phrase to sound right while installing)
,xorg-server,is the graphical server.
,xorg-xinit,starts the graphical server.
,terminus-font,provides the fonts.
,ttf-jetbrains-mono,is used in st because it looks nice
,calc,is used for a dropdown calculator.
,picom,is for transparency and removing screen-tearing.
,dosfstools,allows your computer to access dos-like filesystems.
,exfat-utils,allows management of FAT drives.
,feh,sets the wallpaper and is an image viewer.
,ffmpeg,can record and splice video and audio on the command line.
,vim,is vim
,mpv,is the patrician's choice video player.
,man-db,lets you read man pages of programs.
,firefox,standard browser which I later customise with arkenfox's user.js
,pipewire,lightweight alternative to pulse.
,pipewire-pulse,gives compatibility with PulseAudio programs.
,pavucontrol,is an audio controller.
A,sc-im,is an Excel-like terminal spreadsheet manager.
,unrar,extracts rar's.
,unzip,unzips zips.
,xclip,allows for copying and pasting from the command line.
,yt-dlp,can download any YouTube video (or playlist or channel) when given the link.
,zathura,is a pdf viewer with vim-like bindings.
,zathura-pdf-mupdf,allows mupdf pdf compatibility in zathura.
,acpilight,enables changing screen brightness levels.
,htop,provides a nice interface for running processes
G,https://github.com/wit71/slstatus,serves as the status bar.
G,https://git.suckless.org/dmenu,runs commands and provides a UI for selection.
,rxvt-unicode,is the terminal emulator
G,https://github.com/wit71/st,serves as a different terminal emulator
G,https://github.com/wit71/dwm,is the window manager.
A,ani-cli-git,anime in the command line
,qbittorrent,Is an open source torrent client.
,mlocate,finds files
,dunst,serves as the notification server
